{
  "format_version": 1,
  "name": "Generic storyboard prompt v1",
  "required_sections": [
    "creative_summary",
    "visual_direction",
    "audio_direction",
    "negative_constraints"
  ],
  "min_output_chars": 180,
  "max_output_chars": 4000,
  "forbidden_substrings": [
    "```"
  ],
  "reference_pattern": "@image_(\\d+)",
  "reference_index_base": 0,
  "require_all_attachments_referenced": true
}
